{
  "schema": "singular.orchestration.gate-result.v1",
  "node": "rel-00-contract",
  "status": "passed",
  "authoritative": true,
  "evidenceClass": "deterministic-proof",
  "evidence": [
    {
      "kind": "source-path",
      "ref": "docs/orchestration/tasks/TASK-0108.md",
      "description": "rel-00-contract source package for the promoted gate.",
      "sha256": "aff34450f28cb4bc000f1eb657b146c25b35b42728b1283f3a8b36522e574b58"
    },
    {
      "kind": "task-set",
      "ref": "rel-00-contract-integrated-task",
      "description": "Integrated task slices cited by the rel-00-contract gate-result candidate.",
      "taskIds": [
        "TASK-0108"
      ],
      "sha256": "8e76fa5e60663e2ac3882eb16ee113e3d7fba230983d82df54c00de1bb6ee68c"
    },
    {
      "kind": "command-log",
      "ref": "rel-00-contract-regression-command",
      "description": "Fresh full regression command captured during L0 gate promotion.",
      "command": "bash .singular-state/operator-promotion-gate.sh",
      "exitCode": 0,
      "logRef": "docs/orchestration/gates/evidence/rel-00-contract.regression.txt",
      "sha256": "01d24bb7621d61f501185f34e982d3a0e759ae298ae4d027457ac03358755c7c",
      "headSha": "41380c1b470585cbbbba2633a5fa564211893bff"
    },
    {
      "kind": "gate-report",
      "ref": "docs/orchestration/gates/evidence/rel-00-contract.gate-report.json",
      "sha256": "1fd2264e0ec5f671d186fca627e2655491219595b81267c7a409a329f5f66436",
      "description": "Strict gate-report.v0 bound to the promoted command, log, and worker head."
    }
  ],
  "upstreamGates": [],
  "decidedBy": "l0-gate-promoter",
  "rationale": "rel-00-contract is promoted only after TASK-0108 is integrated and a fresh full Singular regression produces a passing, hash-bound gate report at the integration HEAD.",
  "recordedAt": "2026-08-13T20:27:09Z",
  "verificationClassification": "passed",
  "gateReportRef": "docs/orchestration/gates/evidence/rel-00-contract.gate-report.json"
}
