{
  "schema": "singular.orchestration.gate-result.v1",
  "node": "rel-03-integrity-reclass",
  "status": "passed",
  "authoritative": true,
  "evidenceClass": "deterministic-proof",
  "evidence": [
    {
      "kind": "source-path",
      "ref": "docs/orchestration/tasks/TASK-0111.md",
      "description": "rel-03-integrity-reclass source package for the promoted gate.",
      "sha256": "3e294d4dd99eb2901d4aeecd67a34f9aaf71026261d4e2c248ec50a43c3720f1"
    },
    {
      "kind": "task-set",
      "ref": "rel-03-integrity-reclass-integrated-task",
      "description": "Integrated task slices cited by the rel-03-integrity-reclass gate-result candidate.",
      "taskIds": [
        "TASK-0111"
      ],
      "sha256": "013ebb8e62e2cd3c8d3edb94c1521c65cb7638dc9e87e6075255d268e3147a15"
    },
    {
      "kind": "command-log",
      "ref": "rel-03-integrity-reclass-regression-command",
      "description": "Fresh full regression command captured during L0 gate promotion.",
      "command": "bash tests/run.sh",
      "exitCode": 0,
      "logRef": "docs/orchestration/gates/evidence/rel-03-integrity-reclass.regression.txt",
      "sha256": "8646d137c1b11a96a89bd34bcb897ebcd55bc279a95cec190a9f34cb9310d4c1",
      "headSha": "83e7cf72f2c1bf47c6326f1cc0b8bf0345e2f622"
    },
    {
      "kind": "gate-report",
      "ref": "docs/orchestration/gates/evidence/rel-03-integrity-reclass.gate-report.json",
      "sha256": "2fa0667ae06ec0cf01d826bb9d8881739ba897b98f0aa99f1abe719922356b10",
      "description": "Strict gate-report.v0 bound to the promoted command, log, and worker head."
    }
  ],
  "upstreamGates": [
    "rel-02-try-hygiene"
  ],
  "decidedBy": "l0-gate-promoter",
  "rationale": "rel-03-integrity-reclass is promoted only after TASK-0111 is integrated and a fresh full Singular regression produces a passing, hash-bound gate report at the integration HEAD.",
  "recordedAt": "2026-08-14T19:43:46Z",
  "verificationClassification": "passed",
  "gateReportRef": "docs/orchestration/gates/evidence/rel-03-integrity-reclass.gate-report.json"
}
