{
  "schema": "singular.orchestration.gate-result.v1",
  "node": "rel-08-route-transcript",
  "status": "passed",
  "authoritative": true,
  "evidenceClass": "deterministic-proof",
  "evidence": [
    {
      "kind": "source-path",
      "ref": "docs/orchestration/tasks/TASK-0116.md",
      "description": "rel-08-route-transcript source package for the promoted gate.",
      "sha256": "9a5571cde88200afbb9864fbedddce56a896f6b3ffbab6b27339b1ee40d24723"
    },
    {
      "kind": "task-set",
      "ref": "rel-08-route-transcript-integrated-task",
      "description": "Integrated task slices cited by the rel-08-route-transcript gate-result candidate.",
      "taskIds": [
        "TASK-0116"
      ],
      "sha256": "a3703b70b48f6ee94eba436fb84fb76610dfee429aa3451c1ae954f8d0425570"
    },
    {
      "kind": "command-log",
      "ref": "rel-08-route-transcript-regression-command",
      "description": "Fresh full regression command captured during L0 gate promotion.",
      "command": "bash tests/run.sh",
      "exitCode": 0,
      "logRef": "docs/orchestration/gates/evidence/rel-08-route-transcript.regression.txt",
      "sha256": "8646d137c1b11a96a89bd34bcb897ebcd55bc279a95cec190a9f34cb9310d4c1",
      "headSha": "9919712055d990a2e5bf162796861cb84196ac6d"
    },
    {
      "kind": "gate-report",
      "ref": "docs/orchestration/gates/evidence/rel-08-route-transcript.gate-report.json",
      "sha256": "9292fbb2d939780457fb39ffb295ca2c7b2a51577d9657c89bd41286d12fe966",
      "description": "Strict gate-report.v0 bound to the promoted command, log, and worker head."
    }
  ],
  "upstreamGates": [
    "rel-00-contract"
  ],
  "decidedBy": "l0-gate-promoter",
  "rationale": "rel-08-route-transcript is promoted only after TASK-0116 is integrated and a fresh full Singular regression produces a passing, hash-bound gate report at the integration HEAD.",
  "recordedAt": "2026-08-14T20:35:32Z",
  "verificationClassification": "passed",
  "gateReportRef": "docs/orchestration/gates/evidence/rel-08-route-transcript.gate-report.json"
}
